"No.","Time","Source","Destination","Protocol","Length","Info","deltaTime"
"1","0.000000","128.119.247.197","91.189.90.41","TCP","74","43322 > http [SYN] Seq=0 Win=29200 Len=0 MSS=1460 SACK_PERM=1 TSval=176003179 TSecr=0 WS=128","0.000000"
"2","0.074508","91.189.90.41","128.119.247.197","TCP","74","http > 43322 [SYN, ACK] Seq=0 Ack=1 Win=5792 Len=0 MSS=1460 SACK_PERM=1 TSval=1128740115 TSecr=176003179 WS=128","0.074508"
"3","0.000037","128.119.247.197","91.189.90.41","TCP","66","43322 > http [ACK] Seq=1 Ack=1 Win=29312 Len=0 TSval=176003198 TSecr=1128740115","0.000037"
"4","0.000102","128.119.247.197","91.189.90.41","HTTP","385","GET /14.04/Google/?sourceid=hp HTTP/1.1 ","0.000102"
"5","0.074209","91.189.90.41","128.119.247.197","TCP","66","http > 43322 [ACK] Seq=1 Ack=320 Win=6912 Len=0 TSval=1128740123 TSecr=176003198","0.074209"
"6","0.005907","91.189.90.41","128.119.247.197","TCP","638","[TCP segment of a reassembled PDU]","0.005907"
"7","0.000034","128.119.247.197","91.189.90.41","TCP","66","43322 > http [ACK] Seq=320 Ack=573 Win=30464 Len=0 TSval=176003218 TSecr=1128740123","0.000034"
"8","0.000059","91.189.90.41","128.119.247.197","TCP","1514","[TCP segment of a reassembled PDU]","0.000059"
"9","0.000017","128.119.247.197","91.189.90.41","TCP","66","43322 > http [ACK] Seq=320 Ack=2021 Win=33280 Len=0 TSval=176003218 TSecr=1128740123","0.000017"
"10","0.000048","91.189.90.41","128.119.247.197","HTTP","490","HTTP/1.0 200 OK  (text/html)","0.000048"
"11","0.000013","128.119.247.197","91.189.90.41","TCP","66","43322 > http [ACK] Seq=320 Ack=2445 Win=36224 Len=0 TSval=176003218 TSecr=1128740123","0.000013"
"12","3.943822","128.119.247.197","72.21.91.29","TCP","74","33076 > http [SYN] Seq=0 Win=29200 Len=0 MSS=1460 SACK_PERM=1 TSval=176004204 TSecr=0 WS=128","3.943822"
"13","0.007717","72.21.91.29","128.119.247.197","TCP","74","http > 33076 [SYN, ACK] Seq=0 Ack=1 Win=14480 Len=0 MSS=1460 SACK_PERM=1 TSval=2490009409 TSecr=176004204 WS=512","0.007717"
"14","0.000042","128.119.247.197","72.21.91.29","TCP","66","33076 > http [ACK] Seq=1 Ack=1 Win=29312 Len=0 TSval=176004206 TSecr=2490009409","0.000042"
"15","0.000130","128.119.247.197","72.21.91.29","OCSP","505","Request","0.000130"
"16","0.007640","72.21.91.29","128.119.247.197","TCP","66","http > 33076 [ACK] Seq=1 Ack=440 Win=15872 Len=0 TSval=2490009410 TSecr=176004206","0.007640"
"17","0.000678","72.21.91.29","128.119.247.197","OCSP","854","Response","0.000678"
"18","0.000031","128.119.247.197","72.21.91.29","TCP","66","33076 > http [ACK] Seq=440 Ack=789 Win=30848 Len=0 TSval=176004208 TSecr=2490009411","0.000031"
"19","0.508648","128.119.247.197","72.21.91.29","OCSP","505","Request","0.508648"
"20","0.008441","72.21.91.29","128.119.247.197","OCSP","854","Response","0.008441"
"21","0.000037","128.119.247.197","72.21.91.29","TCP","66","33076 > http [ACK] Seq=879 Ack=1577 Win=32384 Len=0 TSval=176004337 TSecr=2490009540","0.000037"
"22","0.002114","128.119.247.197","72.21.91.29","OCSP","505","Request","0.002114"
"23","0.008198","72.21.91.29","128.119.247.197","OCSP","854","Response","0.008198"
"24","0.039325","128.119.247.197","72.21.91.29","TCP","66","33076 > http [ACK] Seq=1318 Ack=2365 Win=34048 Len=0 TSval=176004350 TSecr=2490009542","0.039325"
"25","0.584297","128.119.247.197","216.58.219.206","TCP","74","38350 > http [SYN] Seq=0 Win=29200 Len=0 MSS=1460 SACK_PERM=1 TSval=176004496 TSecr=0 WS=128","0.584297"
"26","0.007329","216.58.219.206","128.119.247.197","TCP","74","http > 38350 [SYN, ACK] Seq=0 Ack=1 Win=42540 Len=0 MSS=1430 SACK_PERM=1 TSval=3821323126 TSecr=176004496 WS=128","0.007329"
"27","0.000042","128.119.247.197","216.58.219.206","TCP","66","38350 > http [ACK] Seq=1 Ack=1 Win=29312 Len=0 TSval=176004497 TSecr=3821323126","0.000042"
"28","0.000151","128.119.247.197","216.58.219.206","OCSP","503","Request","0.000151"
"29","0.007282","216.58.219.206","128.119.247.197","TCP","66","http > 38350 [ACK] Seq=1 Ack=438 Win=43648 Len=0 TSval=3821323133 TSecr=176004497","0.007282"
"30","0.021592","216.58.219.206","128.119.247.197","OCSP","847","Response","0.021592"
"31","0.000031","128.119.247.197","216.58.219.206","TCP","66","38350 > http [ACK] Seq=438 Ack=782 Win=30848 Len=0 TSval=176004505 TSecr=3821323155","0.000031"
"32","1.671340","128.119.247.197","216.58.219.206","OCSP","503","Request","1.671340"
"33","0.028860","216.58.219.206","128.119.247.197","OCSP","847","Response","0.028860"
"34","0.000026","128.119.247.197","216.58.219.206","TCP","66","38350 > http [ACK] Seq=875 Ack=1563 Win=32384 Len=0 TSval=176004930 TSecr=3821324855","0.000026"
"35","2.729106","128.119.247.197","72.167.239.239","TCP","74","60031 > http [SYN] Seq=0 Win=29200 Len=0 MSS=1460 SACK_PERM=1 TSval=176005612 TSecr=0 WS=128","2.729106"
"36","0.000038","128.119.247.197","72.167.239.239","TCP","74","60032 > http [SYN] Seq=0 Win=29200 Len=0 MSS=1460 SACK_PERM=1 TSval=176005612 TSecr=0 WS=128","0.000038"
"37","0.025872","72.167.239.239","128.119.247.197","TCP","74","http > 60032 [SYN, ACK] Seq=0 Ack=1 Win=14480 Len=0 MSS=1460 SACK_PERM=1 TSval=1947078931 TSecr=176005612 WS=128","0.025872"
"38","0.000044","128.119.247.197","72.167.239.239","TCP","66","60032 > http [ACK] Seq=1 Ack=1 Win=29312 Len=0 TSval=176005619 TSecr=1947078931","0.000044"
"39","0.000118","128.119.247.197","72.167.239.239","OCSP","495","Request","0.000118"
"40","0.000278","72.167.239.239","128.119.247.197","TCP","74","http > 60031 [SYN, ACK] Seq=0 Ack=1 Win=14480 Len=0 MSS=1460 SACK_PERM=1 TSval=1947078931 TSecr=176005612 WS=128","0.000278"
"41","0.000027","128.119.247.197","72.167.239.239","TCP","66","60031 > http [ACK] Seq=1 Ack=1 Win=29312 Len=0 TSval=176005619 TSecr=1947078931","0.000027"
"42","0.000137","128.119.247.197","72.167.239.239","OCSP","495","Request","0.000137"
"43","0.000787","128.119.247.197","72.167.239.239","TCP","74","60033 > http [SYN] Seq=0 Win=29200 Len=0 MSS=1460 SACK_PERM=1 TSval=176005619 TSecr=0 WS=128","0.000787"
"44","0.024632","72.167.239.239","128.119.247.197","TCP","66","http > 60032 [ACK] Seq=1 Ack=430 Win=15616 Len=0 TSval=1947078957 TSecr=176005619","0.024632"
"45","0.000858","72.167.239.239","128.119.247.197","OCSP","2247","Response","0.000858"
"46","0.000029","128.119.247.197","72.167.239.239","TCP","66","60032 > http [ACK] Seq=430 Ack=2182 Win=33664 Len=0 TSval=176005625 TSecr=1947078957","0.000029"
"47","0.000012","72.167.239.239","128.119.247.197","TCP","66","http > 60032 [FIN, ACK] Seq=2182 Ack=430 Win=15616 Len=0 TSval=1947078957 TSecr=176005619","0.000012"
"48","0.000133","72.167.239.239","128.119.247.197","TCP","66","http > 60031 [ACK] Seq=1 Ack=430 Win=15616 Len=0 TSval=1947078957 TSecr=176005619","0.000133"
"49","0.000722","72.167.239.239","128.119.247.197","TCP","74","http > 60033 [SYN, ACK] Seq=0 Ack=1 Win=14480 Len=0 MSS=1460 SACK_PERM=1 TSval=1947078958 TSecr=176005619 WS=128","0.000722"
"50","0.000032","128.119.247.197","72.167.239.239","TCP","66","60033 > http [ACK] Seq=1 Ack=1 Win=29312 Len=0 TSval=176005625 TSecr=1947078958","0.000032"
"51","0.000120","72.167.239.239","128.119.247.197","TCP","1514","[TCP segment of a reassembled PDU]","0.000120"
"52","0.000016","128.119.247.197","72.167.239.239","TCP","66","60031 > http [ACK] Seq=430 Ack=1449 Win=32128 Len=0 TSval=176005625 TSecr=1947078958","0.000016"
"53","0.000057","72.167.239.239","128.119.247.197","OCSP","799","Response","0.000057"
"54","0.000018","128.119.247.197","72.167.239.239","TCP","66","60031 > http [ACK] Seq=430 Ack=2182 Win=35072 Len=0 TSval=176005626 TSecr=1947078958","0.000018"
"55","0.000009","72.167.239.239","128.119.247.197","TCP","66","http > 60031 [FIN, ACK] Seq=2182 Ack=430 Win=15616 Len=0 TSval=1947078958 TSecr=176005619","0.000009"
"56","0.001523","128.119.247.197","72.167.239.239","TCP","66","60032 > http [FIN, ACK] Seq=430 Ack=2183 Win=33664 Len=0 TSval=176005626 TSecr=1947078957","0.001523"
"57","0.009438","128.119.247.197","72.167.239.239","TCP","66","60031 > http [FIN, ACK] Seq=430 Ack=2183 Win=35072 Len=0 TSval=176005628 TSecr=1947078958","0.009438"
"58","0.016392","72.167.239.239","128.119.247.197","TCP","66","http > 60032 [ACK] Seq=2183 Ack=431 Win=15616 Len=0 TSval=1947078986 TSecr=176005626","0.016392"
"59","0.010072","72.167.239.239","128.119.247.197","TCP","66","http > 60031 [ACK] Seq=2183 Ack=431 Win=15616 Len=0 TSval=1947078996 TSecr=176005628","0.010072"
"60","0.330550","128.119.247.197","91.189.90.41","TCP","66","[TCP Keep-Alive] 43322 > http [ACK] Seq=319 Ack=2445 Win=36224 Len=0 TSval=176005718 TSecr=1128740123","0.330550"
"61","0.074347","91.189.90.41","128.119.247.197","TCP","66","[TCP Keep-Alive ACK] http > 43322 [ACK] Seq=2445 Ack=320 Win=6912 Len=0 TSval=1128741131 TSecr=176003218","0.074347"
"62","0.646626","72.167.239.239","128.119.247.197","TCP","74","[TCP Retransmission] http > 60033 [SYN, ACK] Seq=0 Ack=1 Win=14480 Len=0 MSS=1460 SACK_PERM=1 TSval=1947080048 TSecr=176005625 WS=128","0.646626"
"63","0.000045","128.119.247.197","72.167.239.239","TCP","66","[TCP Dup ACK 50#1] 60033 > http [ACK] Seq=1 Ack=1 Win=29312 Len=0 TSval=176005898 TSecr=1947078958","0.000045"
"64","3.766950","128.119.247.197","72.21.91.29","TCP","66","[TCP Keep-Alive] 33076 > http [ACK] Seq=1317 Ack=2365 Win=34048 Len=0 TSval=176006840 TSecr=2490009542","3.766950"
"65","0.007705","72.21.91.29","128.119.247.197","TCP","66","[TCP Keep-Alive ACK] http > 33076 [ACK] Seq=2365 Ack=1318 Win=17920 Len=0 TSval=2490012044 TSecr=176004350","0.007705"
"66","0.104758","72.167.239.239","128.119.247.197","TCP","60","http > 60032 [RST] Seq=2183 Win=0 Len=0","0.104758"
"67","0.000340","72.167.239.239","128.119.247.197","TCP","60","http > 60031 [RST] Seq=2183 Win=0 Len=0","0.000340"
"68","0.418535","128.119.247.197","72.167.239.239","TCP","66","60033 > http [FIN, ACK] Seq=1 Ack=1 Win=29312 Len=0 TSval=176006972 TSecr=1947078958","0.418535"
"69","0.026476","72.167.239.239","128.119.247.197","TCP","66","http > 60033 [FIN, ACK] Seq=1 Ack=2 Win=14592 Len=0 TSval=1947084372 TSecr=176006972","0.026476"
"70","0.000038","128.119.247.197","72.167.239.239","TCP","66","60033 > http [ACK] Seq=2 Ack=2 Win=29312 Len=0 TSval=176006979 TSecr=1947084372","0.000038"
"71","1.806195","128.119.247.197","216.58.219.206","TCP","66","[TCP Keep-Alive] 38350 > http [ACK] Seq=874 Ack=1563 Win=32384 Len=0 TSval=176007431 TSecr=3821324855","1.806195"
"72","0.007365","216.58.219.206","128.119.247.197","TCP","66","[TCP Keep-Alive ACK] http > 38350 [ACK] Seq=1563 Ack=875 Win=44800 Len=0 TSval=3821334865 TSecr=176004930","0.007365"
"73","2.769454","72.167.239.239","128.119.247.197","TCP","60","http > 60033 [RST] Seq=2 Win=0 Len=0","2.769454"
"74","0.459144","128.119.247.197","91.189.90.41","TCP","66","[TCP Keep-Alive] 43322 > http [ACK] Seq=319 Ack=2445 Win=36224 Len=0 TSval=176008240 TSecr=1128741131","0.459144"
"75","0.074824","91.189.90.41","128.119.247.197","TCP","66","[TCP Keep-Alive ACK] http > 43322 [ACK] Seq=2445 Ack=320 Win=6912 Len=0 TSval=1128742139 TSecr=176003218","0.074824"
"76","0.189229","72.21.91.29","128.119.247.197","TCP","66","http > 33076 [FIN, ACK] Seq=2365 Ack=1318 Win=17920 Len=0 TSval=2490013508 TSecr=176004350","0.189229"
"77","0.000122","128.119.247.197","72.21.91.29","TCP","66","33076 > http [FIN, ACK] Seq=1318 Ack=2366 Win=34048 Len=0 TSval=176008306 TSecr=2490013508","0.000122"
"78","0.007691","72.21.91.29","128.119.247.197","TCP","66","http > 33076 [ACK] Seq=2366 Ack=1319 Win=17920 Len=0 TSval=2490013510 TSecr=176008306","0.007691"
"79","6.512184","128.119.247.197","216.58.219.206","TCP","66","[TCP Keep-Alive] 38350 > http [ACK] Seq=874 Ack=1563 Win=32384 Len=0 TSval=176009936 TSecr=3821334865","6.512184"
"80","0.007390","216.58.219.206","128.119.247.197","TCP","66","[TCP Keep-Alive ACK] http > 38350 [ACK] Seq=1563 Ack=875 Win=44800 Len=0 TSval=3821344886 TSecr=176004930","0.007390"
"81","3.288548","128.119.247.197","91.189.90.41","TCP","66","[TCP Keep-Alive] 43322 > http [ACK] Seq=319 Ack=2445 Win=36224 Len=0 TSval=176010760 TSecr=1128742139","3.288548"
"82","0.074455","91.189.90.41","128.119.247.197","TCP","66","[TCP Keep-Alive ACK] http > 43322 [ACK] Seq=2445 Ack=320 Win=6912 Len=0 TSval=1128743147 TSecr=176003218","0.074455"
"83","6.645591","128.119.247.197","216.58.219.206","TCP","66","[TCP Keep-Alive] 38350 > http [ACK] Seq=874 Ack=1563 Win=32384 Len=0 TSval=176012440 TSecr=3821344886","6.645591"
"84","0.007277","216.58.219.206","128.119.247.197","TCP","66","[TCP Keep-Alive ACK] http > 38350 [ACK] Seq=1563 Ack=875 Win=44800 Len=0 TSval=3821354901 TSecr=176004930","0.007277"
"85","3.352724","128.119.247.197","91.189.90.41","TCP","66","[TCP Keep-Alive] 43322 > http [ACK] Seq=319 Ack=2445 Win=36224 Len=0 TSval=176013280 TSecr=1128743147","3.352724"
"86","0.074144","91.189.90.41","128.119.247.197","TCP","66","[TCP Keep-Alive ACK] http > 43322 [ACK] Seq=2445 Ack=320 Win=6912 Len=0 TSval=1128744155 TSecr=176003218","0.074144"
"87","6.581874","128.119.247.197","216.58.219.206","TCP","66","[TCP Keep-Alive] 38350 > http [ACK] Seq=874 Ack=1563 Win=32384 Len=0 TSval=176014944 TSecr=3821354901","6.581874"
"88","0.007325","216.58.219.206","128.119.247.197","TCP","66","[TCP Keep-Alive ACK] http > 38350 [ACK] Seq=1563 Ack=875 Win=44800 Len=0 TSval=3821364917 TSecr=176004930","0.007325"
"89","3.416681","128.119.247.197","91.189.90.41","TCP","66","[TCP Keep-Alive] 43322 > http [ACK] Seq=319 Ack=2445 Win=36224 Len=0 TSval=176015800 TSecr=1128744155","3.416681"
"90","0.074478","91.189.90.41","128.119.247.197","TCP","66","[TCP Keep-Alive ACK] http > 43322 [ACK] Seq=2445 Ack=320 Win=6912 Len=0 TSval=1128745163 TSecr=176003218","0.074478"
"91","6.517462","128.119.247.197","216.58.219.206","TCP","66","[TCP Keep-Alive] 38350 > http [ACK] Seq=874 Ack=1563 Win=32384 Len=0 TSval=176017448 TSecr=3821364917","6.517462"
"92","0.007318","216.58.219.206","128.119.247.197","TCP","66","[TCP Keep-Alive ACK] http > 38350 [ACK] Seq=1563 Ack=875 Win=44800 Len=0 TSval=3821374933 TSecr=176004930","0.007318"
"93","3.480696","128.119.247.197","91.189.90.41","TCP","66","[TCP Keep-Alive] 43322 > http [ACK] Seq=319 Ack=2445 Win=36224 Len=0 TSval=176018320 TSecr=1128745163","3.480696"
"94","0.074088","91.189.90.41","128.119.247.197","TCP","66","[TCP Keep-Alive ACK] http > 43322 [ACK] Seq=2445 Ack=320 Win=6912 Len=0 TSval=1128746171 TSecr=176003218","0.074088"
"95","6.453958","128.119.247.197","216.58.219.206","TCP","66","[TCP Keep-Alive] 38350 > http [ACK] Seq=874 Ack=1563 Win=32384 Len=0 TSval=176019952 TSecr=3821374933","6.453958"
"96","0.007196","216.58.219.206","128.119.247.197","TCP","66","[TCP Keep-Alive ACK] http > 38350 [ACK] Seq=1563 Ack=875 Win=44800 Len=0 TSval=3821384949 TSecr=176004930","0.007196"
"97","3.544793","128.119.247.197","91.189.90.41","TCP","66","[TCP Keep-Alive] 43322 > http [ACK] Seq=319 Ack=2445 Win=36224 Len=0 TSval=176020840 TSecr=1128746171","3.544793"
"98","0.074184","91.189.90.41","128.119.247.197","TCP","66","[TCP Keep-Alive ACK] http > 43322 [ACK] Seq=2445 Ack=320 Win=6912 Len=0 TSval=1128747179 TSecr=176003218","0.074184"
"99","6.389770","128.119.247.197","216.58.219.206","TCP","66","[TCP Keep-Alive] 38350 > http [ACK] Seq=874 Ack=1563 Win=32384 Len=0 TSval=176022456 TSecr=3821384949","6.389770"
"100","0.007305","216.58.219.206","128.119.247.197","TCP","66","[TCP Keep-Alive ACK] http > 38350 [ACK] Seq=1563 Ack=875 Win=44800 Len=0 TSval=3821394965 TSecr=176004930","0.007305"
"101","3.608746","128.119.247.197","91.189.90.41","TCP","66","[TCP Keep-Alive] 43322 > http [ACK] Seq=319 Ack=2445 Win=36224 Len=0 TSval=176023360 TSecr=1128747179","3.608746"
"102","0.074182","91.189.90.41","128.119.247.197","TCP","66","[TCP Keep-Alive ACK] http > 43322 [ACK] Seq=2445 Ack=320 Win=6912 Len=0 TSval=1128748187 TSecr=176003218","0.074182"
"103","6.325824","128.119.247.197","216.58.219.206","TCP","66","[TCP Keep-Alive] 38350 > http [ACK] Seq=874 Ack=1563 Win=32384 Len=0 TSval=176024960 TSecr=3821394965","6.325824"
"104","0.007396","216.58.219.206","128.119.247.197","TCP","66","[TCP Keep-Alive ACK] http > 38350 [ACK] Seq=1563 Ack=875 Win=44800 Len=0 TSval=3821404982 TSecr=176004930","0.007396"
"105","3.672582","128.119.247.197","91.189.90.41","TCP","66","[TCP Keep-Alive] 43322 > http [ACK] Seq=319 Ack=2445 Win=36224 Len=0 TSval=176025880 TSecr=1128748187","3.672582"
"106","0.074496","91.189.90.41","128.119.247.197","TCP","66","[TCP Keep-Alive ACK] http > 43322 [ACK] Seq=2445 Ack=320 Win=6912 Len=0 TSval=1128749195 TSecr=176003218","0.074496"
"107","6.261531","128.119.247.197","216.58.219.206","TCP","66","[TCP Keep-Alive] 38350 > http [ACK] Seq=874 Ack=1563 Win=32384 Len=0 TSval=176027464 TSecr=3821404982","6.261531"
"108","0.007353","216.58.219.206","128.119.247.197","TCP","66","[TCP Keep-Alive ACK] http > 38350 [ACK] Seq=1563 Ack=875 Win=44800 Len=0 TSval=3821414997 TSecr=176004930","0.007353"
"109","3.736619","128.119.247.197","91.189.90.41","TCP","66","[TCP Keep-Alive] 43322 > http [ACK] Seq=319 Ack=2445 Win=36224 Len=0 TSval=176028400 TSecr=1128749195","3.736619"
"110","0.074261","91.189.90.41","128.119.247.197","TCP","66","[TCP Keep-Alive ACK] http > 43322 [ACK] Seq=2445 Ack=320 Win=6912 Len=0 TSval=1128750203 TSecr=176003218","0.074261"
